{"schema":"assay.ledger-state/1","repo_id":42,"pr":7,"evidence":{"run_id":7001,"run_attempt":1,"sha256":"sha256:eeeeeeeeeeeeeeeeeeeeeeeeeeeeeeeeeeeeeeeeeeeeeeeeeeeeeeeeeeeeeeee"},"decision":{"run_id":7004,"sha256":"sha256:dddddddddddddddddddddddddddddddddddddddddddddddddddddddddddddddd"},"published":{"head_sha":"bbbbbbbbbbbbbbbbbbbbbbbbbbbbbbbbbbbbbbbb","key":"sha256:cccccccccccccccccccccccccccccccccccccccccccccccccccccccccccccccc","run_id":7005},"evidence_records":[{"evidence_key":"sha256:aaaaaaaaaaaaaaaaaaaaaaaaaaaaaaaaaaaaaaaaaaaaaaaaaaaaaaaaaaaaaaaa","bundle_sha256":"sha256:eeeeeeeeeeeeeeeeeeeeeeeeeeeeeeeeeeeeeeeeeeeeeeeeeeeeeeeeeeeeeeee","llm":"complete","tier":"full"},{"evidence_key":"sha256:cccccccccccccccccccccccccccccccccccccccccccccccccccccccccccccccc","bundle_sha256":"sha256:dddddddddddddddddddddddddddddddddddddddddddddddddddddddddddddddd","llm":"skipped(draft)","tier":"lite"}],"deferral":{"repo":"acme/widgets","pr":7,"head":"bbbbbbbbbbbbbbbbbbbbbbbbbbbbbbbbbbbbbbbb","count":1,"resets_at":"2026-10-12T14:00:00.000Z","flag":false},"actor_counters":[{"actor_id":1001,"count":2},{"actor_id":1002,"count":1}]}
